{
  "ticket_id": "T-P2.7-001",
  "title": "Controlled live observation get_lunar",
  "phase": "P2.7_CONTROLLED_LIVE_OBSERVATION",
  "status": "BLOCKED_SUPERVISOR",
  "scope": "one bound WS session observation only",
  "created_at": "2026-09-19T17:05:00Z",
  "updated_at": "2026-09-19T17:10:00Z",
  "audit_revisits_used": 0,
  "patch_attempts_used": 0,
  "verification_runs_used": 0,
  "subagent_invocations_used": 2,
  "max_audit_revisits": 2,
  "max_patch_attempts": 2,
  "max_verification_runs": 3,
  "max_subagent_invocations": 8,
  "current_failure_signature": {
    "signature_hash": null,
    "fields": {
      "layer": "LIVE_WS",
      "test_case": "get_lunar",
      "assertion": "USEFUL_PIPELINE_TRACE",
      "observed": "connection_closed_1000_no_server_logs",
      "source": "p27_live_once"
    }
  },
  "failure_signature_history": [],
  "new_evidence_since_last_attempt": true,
  "measurable_progress": false,
  "files_allowed": ["/opt/xiaozhi-clean/agent-lab/"],
  "files_changed": [],
  "tests_required": ["P2.7_LIVE_GET_LUNAR"],
  "tests_executed": ["P2.7_LIVE_GET_LUNAR"],
  "tests_passed": [],
  "tests_failed": ["P2.7_LIVE_GET_LUNAR"],
  "runtime_touched": false,
  "db_touched": false,
  "provider_touched": false,
  "infra_touched": false,
  "auditor_status": "PENDING",
  "implementer_status": "DISABLED",
  "verifier_status": "PENDING",
  "supervisor_required": true,
  "supervisor_decision": null,
  "stop_reason": "NO_NEW_EVIDENCE",
  "report_path": "/opt/xiaozhi-clean/agent-lab/supervisor/reports/P2.7-live-observation.md",
  "evidence_path": "/opt/xiaozhi-clean/agent-lab/evidence/P2.7/"
}
