{
  "ticket_id": "T-P2.6-001",
  "title": "Supervisor bridge and loop policy",
  "phase": "P2.6_SUPERVISOR_BRIDGE_AND_LOOP_POLICY",
  "status": "SUPERVISOR_REVIEW",
  "scope": "agent-lab orchestration only; no Clean runtime",
  "created_at": "2026-09-19T16:35:00Z",
  "updated_at": "2026-09-19T16:56:18+00:00",
  "audit_revisits_used": 1,
  "patch_attempts_used": 0,
  "verification_runs_used": 2,
  "subagent_invocations_used": 3,
  "max_audit_revisits": 2,
  "max_patch_attempts": 2,
  "max_verification_runs": 3,
  "max_subagent_invocations": 8,
  "current_failure_signature": null,
  "failure_signature_history": [],
  "new_evidence_since_last_attempt": true,
  "measurable_progress": true,
  "files_allowed": [
    "/opt/xiaozhi-clean/agent-lab/",
    "/opt/xiaozhi-clean/.cursor/"
  ],
  "files_changed": [],
  "tests_required": [
    "TEST_LOOP_1",
    "TEST_LOOP_2",
    "TEST_LOOP_3",
    "TEST_LOOP_4",
    "TEST_LOOP_5",
    "TEST_LOOP_6",
    "TEST_LOOP_7",
    "TEST_LOOP_8"
  ],
  "tests_executed": [
    "TEST_LOOP_1",
    "TEST_LOOP_2",
    "TEST_LOOP_3",
    "TEST_LOOP_4",
    "TEST_LOOP_5",
    "TEST_LOOP_6",
    "TEST_LOOP_7",
    "TEST_LOOP_8",
    "LIVE_GATE"
  ],
  "tests_passed": [
    "TEST_LOOP_1",
    "TEST_LOOP_2",
    "TEST_LOOP_3",
    "TEST_LOOP_4",
    "TEST_LOOP_5",
    "TEST_LOOP_6",
    "TEST_LOOP_7",
    "TEST_LOOP_8",
    "LIVE_GATE"
  ],
  "tests_failed": [],
  "runtime_touched": false,
  "db_touched": false,
  "provider_touched": false,
  "infra_touched": false,
  "auditor_status": "PASS",
  "implementer_status": "DISABLED",
  "verifier_status": "PASS",
  "supervisor_required": true,
  "supervisor_decision": null,
  "stop_reason": null,
  "report_path": "/opt/xiaozhi-clean/agent-lab/supervisor/reports/P2.6-checkpoint.md",
  "evidence_path": "/opt/xiaozhi-clean/agent-lab/supervisor/evidence/"
}
